{
  "schemaVersion": "1",
  "toolVersion": "0.4.0",
  "kind": "policy-review",
  "generatedAt": "2026-08-04T21:02:01.653Z",
  "sources": {
    "before": {
      "filename": "before.config.json",
      "fingerprint": "sha256:092c5d2a7b43924665a25e64f0a894382d97499aa33da449c6b2374dde8f2e31"
    },
    "after": {
      "filename": "after-weakened.config.json",
      "fingerprint": "sha256:5fabc9a80e26bc85e44a3c8347b7a95c49f85b7f2b704e5dd52f524d40cb7d2a"
    }
  },
  "summary": {
    "changes": 48,
    "weakened": 46,
    "strengthened": 0,
    "review": 2,
    "gateFailed": true
  },
  "changes": [
    {
      "id": "POLICY-F83223BCEA",
      "classification": "weakened",
      "category": "baseline-governance",
      "key": "baselinePolicy.maxAgeDays",
      "title": "Baseline maximum age changed from 30 to 90",
      "titleZh": "基线最大期限从 30 调整为 90",
      "rationale": "The new numeric limit allows more risk than before.",
      "rationaleZh": "新的数值限制比以前允许更多风险。",
      "before": 30,
      "after": 90
    },
    {
      "id": "POLICY-61E57210E5",
      "classification": "weakened",
      "category": "baseline-governance",
      "key": "baselinePolicy.requireSamePolicy",
      "title": "Same-policy baseline requirement was disabled",
      "titleZh": "同策略基线要求已停用",
      "rationale": "A previously enforced protection is no longer required.",
      "rationaleZh": "原先强制执行的保护现在不再要求。",
      "before": true,
      "after": false
    },
    {
      "id": "POLICY-0E96512F8B",
      "classification": "weakened",
      "category": "checks",
      "key": "checks.release-action-visible",
      "title": "Declarative check release-action-visible was removed",
      "titleZh": "移除声明式检查 release-action-visible",
      "rationale": "A previously declared requirement is no longer covered.",
      "rationaleZh": "原先声明的要求现在不再覆盖。",
      "before": "present",
      "after": "absent"
    },
    {
      "id": "POLICY-869AFDE03E",
      "classification": "weakened",
      "category": "coverage",
      "key": "crawl.enabled",
      "title": "Safe crawl was disabled",
      "titleZh": "安全爬取已停用",
      "rationale": "A previously enforced protection is no longer required.",
      "rationaleZh": "原先强制执行的保护现在不再要求。",
      "before": true,
      "after": false
    },
    {
      "id": "POLICY-F300D0250A",
      "classification": "weakened",
      "category": "coverage",
      "key": "crawl.maxDepth",
      "title": "Crawl depth changed from 2 to 1",
      "titleZh": "爬取深度从 2 调整为 1",
      "rationale": "The new numeric limit allows more risk than before.",
      "rationaleZh": "新的数值限制比以前允许更多风险。",
      "before": 2,
      "after": 1
    },
    {
      "id": "POLICY-495F65944C",
      "classification": "weakened",
      "category": "coverage",
      "key": "crawl.maxPages",
      "title": "Crawl page limit changed from 20 to 10",
      "titleZh": "爬取页面上限从 20 调整为 10",
      "rationale": "The new numeric limit allows more risk than before.",
      "rationaleZh": "新的数值限制比以前允许更多风险。",
      "before": 20,
      "after": 10
    },
    {
      "id": "POLICY-A6D8A45661",
      "classification": "weakened",
      "category": "coverage",
      "key": "mode",
      "title": "Scenario mode changed from deep to quick",
      "titleZh": "场景模式从 deep 调整为 quick",
      "rationale": "Quick mode removes Deep-only proving scenarios.",
      "rationaleZh": "Quick 模式会移除仅 Deep 提供的证明场景。",
      "before": "deep",
      "after": "quick"
    },
    {
      "id": "POLICY-02D03521A9",
      "classification": "weakened",
      "category": "exceptions",
      "key": "exceptions.temporary-release-action",
      "title": "Governed waiver temporary-release-action was added",
      "titleZh": "新增受治理豁免 temporary-release-action",
      "rationale": "A new exception can suppress otherwise active release evidence.",
      "rationaleZh": "新增例外可能排除原本有效的发布证据。",
      "before": "absent",
      "after": "present"
    },
    {
      "id": "POLICY-A2FF61C4FA",
      "classification": "weakened",
      "category": "links",
      "key": "links.maxChecked",
      "title": "Checked-link cap changed from 50 to 10",
      "titleZh": "链接核查上限从 50 调整为 10",
      "rationale": "The new numeric limit allows more risk than before.",
      "rationaleZh": "新的数值限制比以前允许更多风险。",
      "before": 50,
      "after": 10
    },
    {
      "id": "POLICY-12820F96AA",
      "classification": "weakened",
      "category": "links",
      "key": "links.maxFailures",
      "title": "Allowed broken links changed from 0 to 3",
      "titleZh": "允许失效链接数从 0 调整为 3",
      "rationale": "The new numeric limit allows more risk than before.",
      "rationaleZh": "新的数值限制比以前允许更多风险。",
      "before": 0,
      "after": 3
    },
    {
      "id": "POLICY-913C716E51",
      "classification": "weakened",
      "category": "links",
      "key": "links.severity",
      "title": "Link finding severity changed from major to minor",
      "titleZh": "链接问题严重级别从 major 调整为 minor",
      "rationale": "The new severity setting is less likely to block risky evidence.",
      "rationaleZh": "新的严重级别设置更不容易阻止风险证据。",
      "before": "major",
      "after": "minor"
    },
    {
      "id": "POLICY-C1FEAF9C48",
      "classification": "weakened",
      "category": "metadata",
      "key": "metadata.forbidNoindex",
      "title": "Metadata rule forbidNoindex was disabled",
      "titleZh": "元数据规则 forbidNoindex已停用",
      "rationale": "A previously enforced protection is no longer required.",
      "rationaleZh": "原先强制执行的保护现在不再要求。",
      "before": true,
      "after": false
    },
    {
      "id": "POLICY-96F36B56D8",
      "classification": "weakened",
      "category": "metadata",
      "key": "metadata.requireCanonical",
      "title": "Metadata rule requireCanonical was disabled",
      "titleZh": "元数据规则 requireCanonical已停用",
      "rationale": "A previously enforced protection is no longer required.",
      "rationaleZh": "原先强制执行的保护现在不再要求。",
      "before": true,
      "after": false
    },
    {
      "id": "POLICY-68615A65A8",
      "classification": "weakened",
      "category": "metadata",
      "key": "metadata.requireLang",
      "title": "Metadata rule requireLang was disabled",
      "titleZh": "元数据规则 requireLang已停用",
      "rationale": "A previously enforced protection is no longer required.",
      "rationaleZh": "原先强制执行的保护现在不再要求。",
      "before": true,
      "after": false
    },
    {
      "id": "POLICY-F2E879608D",
      "classification": "weakened",
      "category": "metadata",
      "key": "metadata.requireSingleH1",
      "title": "Metadata rule requireSingleH1 was disabled",
      "titleZh": "元数据规则 requireSingleH1已停用",
      "rationale": "A previously enforced protection is no longer required.",
      "rationaleZh": "原先强制执行的保护现在不再要求。",
      "before": true,
      "after": false
    },
    {
      "id": "POLICY-8579F356F2",
      "classification": "weakened",
      "category": "metadata",
      "key": "metadata.severity",
      "title": "Metadata finding severity changed from major to minor",
      "titleZh": "元数据问题严重级别从 major 调整为 minor",
      "rationale": "The new severity setting is less likely to block risky evidence.",
      "rationaleZh": "新的严重级别设置更不容易阻止风险证据。",
      "before": "major",
      "after": "minor"
    },
    {
      "id": "POLICY-6FE4D1252B",
      "classification": "weakened",
      "category": "network",
      "key": "network.maxFailedRequests",
      "title": "Network limit maxFailedRequests changed from 0 to 1",
      "titleZh": "网络限制 maxFailedRequests从 0 调整为 1",
      "rationale": "The new numeric limit allows more risk than before.",
      "rationaleZh": "新的数值限制比以前允许更多风险。",
      "before": 0,
      "after": 1
    },
    {
      "id": "POLICY-1DE89D585C",
      "classification": "weakened",
      "category": "network",
      "key": "network.maxHttpErrors",
      "title": "Network limit maxHttpErrors changed from 0 to 2",
      "titleZh": "网络限制 maxHttpErrors从 0 调整为 2",
      "rationale": "The new numeric limit allows more risk than before.",
      "rationaleZh": "新的数值限制比以前允许更多风险。",
      "before": 0,
      "after": 2
    },
    {
      "id": "POLICY-3543261F0E",
      "classification": "weakened",
      "category": "network",
      "key": "network.scope",
      "title": "Network scope changed from all to api",
      "titleZh": "网络范围从 all 调整为 api",
      "rationale": "Only API-like requests remain governed.",
      "rationaleZh": "现在仅治理类似 API 的请求。",
      "before": "all",
      "after": "api"
    },
    {
      "id": "POLICY-FED886BDB6",
      "classification": "weakened",
      "category": "network",
      "key": "network.severity",
      "title": "Network finding severity changed from major to minor",
      "titleZh": "网络问题严重级别从 major 调整为 minor",
      "rationale": "The new severity setting is less likely to block risky evidence.",
      "rationaleZh": "新的严重级别设置更不容易阻止风险证据。",
      "before": "major",
      "after": "minor"
    },
    {
      "id": "POLICY-DDD6491ED4",
      "classification": "weakened",
      "category": "performance",
      "key": "budgets.cumulativeLayoutShift",
      "title": "Performance limit cumulativeLayoutShift changed from 0.1 to 0.25",
      "titleZh": "性能限制 cumulativeLayoutShift从 0.1 调整为 0.25",
      "rationale": "The new numeric limit allows more risk than before.",
      "rationaleZh": "新的数值限制比以前允许更多风险。",
      "before": 0.1,
      "after": 0.25
    },
    {
      "id": "POLICY-7EF09AF1B7",
      "classification": "weakened",
      "category": "performance",
      "key": "budgets.largestContentfulPaintMs",
      "title": "Performance limit largestContentfulPaintMs changed from 2500 to 4000",
      "titleZh": "性能限制 largestContentfulPaintMs从 2500 调整为 4000",
      "rationale": "The new numeric limit allows more risk than before.",
      "rationaleZh": "新的数值限制比以前允许更多风险。",
      "before": 2500,
      "after": 4000
    },
    {
      "id": "POLICY-AD6FEA01A9",
      "classification": "weakened",
      "category": "performance",
      "key": "budgets.severity",